{
  "schema": "lifecycle.execution-output-manifest.v1",
  "specificationDigest": "sha256:4040404040404040404040404040404040404040404040404040404040404040",
  "inputSetDigest": "sha256:4141414141414141414141414141414141414141414141414141414141414141",
  "imageDigest": "sha256:4242424242424242424242424242424242424242424242424242424242424242",
  "outputContractDigest": "sha256:4343434343434343434343434343434343434343434343434343434343434343",
  "runnerDigest": "sha256:4444444444444444444444444444444444444444444444444444444444444444",
  "completedAt": "2026-08-29T12:00:00.000Z",
  "entries": [
    {
      "path": "outputs/semantic.md",
      "entryKind": "file",
      "purpose": "agent-work-product",
      "mediaType": "text/markdown",
      "modeClass": "regular",
      "byteLength": 128,
      "digest": "sha256:4545454545454545454545454545454545454545454545454545454545454545"
    }
  ],
  "entryCount": 1,
  "aggregateByteLength": 128,
  "entryInventoryDigest": "sha256:4646464646464646464646464646464646464646464646464646464646464646",
  "digest": "sha256:4747474747474747474747474747474747474747474747474747474747474747"
}
